{
  "schema_version": 1,
  "id": "stabilize",
  "kind": "action",
  "cli_verb": "stabilize",
  "targets": ["target"],
  "effects": [
    {"op":"set_stable","target":"target"},
    {"op":"clear_death_saves","target":"target"}
  ],
  "log_templates": {
    "apply": "{actor.name} stabilizes {target.name} at 0 HP"
  }
}
